{
  "_meta": {
    "synthetic": true,
    "note": "DỮ LIỆU MINH HỌA cho demo hackathon — KHÔNG phải trích dẫn luật thật. Số liệu (8%/9%...) dựng để minh họa cơ chế; nếu thay bằng luật thật phải giữ nhất quán (NFR-6). Chứa sẵn 3 bằng chứng benchmark + 1 ca xung đột."
  },
  "documents": [
    {
      "doc_code": "TT41",
      "title": "Thông tư 41/2016/TT-NHNN (minh họa)",
      "type": "ThongTu",
      "issuer": "NHNN",
      "issue_date": "2016-12-30",
      "effective_date": "2016-01-01",
      "visibility": "public"
    },
    {
      "doc_code": "TT22",
      "title": "Thông tư 22/2019/TT-NHNN — sửa đổi TT41 (minh họa)",
      "type": "ThongTu",
      "issuer": "NHNN",
      "issue_date": "2019-11-15",
      "effective_date": "2023-01-01",
      "visibility": "public"
    },
    {
      "doc_code": "QD-INT",
      "title": "Quy trình thẩm định tín dụng nội bộ SHB v3 (minh họa)",
      "type": "QuyTrinhNoiBo",
      "issuer": "SHB",
      "issue_date": "2019-06-01",
      "effective_date": "2019-06-01",
      "visibility": "internal"
    }
  ],
  "clauses": [
    {
      "clause_id": "TT41/Điều 6.3",
      "doc_code": "TT41",
      "path": "Điều 6.3",
      "text": "Tỷ lệ an toàn vốn tối thiểu là 8%.",
      "effective_date": "2016-01-01",
      "expiry_date": "2023-01-01",
      "topic": "ty_le_an_toan_von",
      "visibility": "public",
      "metric": { "value": 8, "unit": "%" }
    },
    {
      "clause_id": "TT22/Điều 1",
      "doc_code": "TT22",
      "path": "Điều 1",
      "text": "Tỷ lệ an toàn vốn tối thiểu là 9%.",
      "effective_date": "2023-01-01",
      "expiry_date": null,
      "topic": "ty_le_an_toan_von",
      "visibility": "public",
      "metric": { "value": 9, "unit": "%" }
    },
    {
      "clause_id": "TT41/Điều 8.1",
      "doc_code": "TT41",
      "path": "Điều 8.1",
      "text": "Ngân hàng phải báo cáo tỷ lệ an toàn vốn định kỳ hằng quý.",
      "effective_date": "2016-01-01",
      "expiry_date": null,
      "topic": "bao_cao_dinh_ky",
      "visibility": "public"
    },
    {
      "clause_id": "TT41/Điều 8.2",
      "doc_code": "TT41",
      "path": "Điều 8.2",
      "text": "Báo cáo phải được nộp bằng bản giấy trực tiếp tại trụ sở NHNN.",
      "effective_date": "2016-01-01",
      "expiry_date": "2023-01-01",
      "topic": "bao_cao_dinh_ky",
      "visibility": "public"
    },
    {
      "clause_id": "TT41/Điều 10",
      "doc_code": "TT41",
      "path": "Điều 10",
      "text": "Việc xác định vốn tự có để tính tỷ lệ an toàn vốn thực hiện theo quy định tại Điều 6.",
      "effective_date": "2016-01-01",
      "expiry_date": null,
      "topic": "von_tu_co",
      "visibility": "public"
    },
    {
      "clause_id": "TT22/Điều 2",
      "doc_code": "TT22",
      "path": "Điều 2",
      "text": "Bãi bỏ quy định nộp báo cáo bằng bản giấy trực tiếp; chuyển sang nộp điện tử.",
      "effective_date": "2023-01-01",
      "expiry_date": null,
      "topic": "bao_cao_dinh_ky",
      "visibility": "public"
    },
    {
      "clause_id": "QD-INT/Điều 2",
      "doc_code": "QD-INT",
      "path": "Điều 2",
      "text": "Khi thẩm định, cán bộ tín dụng áp dụng tỷ lệ an toàn vốn tối thiểu 8%.",
      "effective_date": "2019-06-01",
      "expiry_date": null,
      "topic": "ty_le_an_toan_von",
      "visibility": "internal",
      "metric": { "value": 8, "unit": "%" }
    }
  ],
  "edges": [
    {
      "from": "TT22/Điều 1",
      "to": "TT41/Điều 6.3",
      "type": "SUPERSEDES",
      "note": "Bằng chứng A (bẫy số): 8% → 9%. TT41/Điều 6.3 hết hiệu lực 2023-01-01."
    },
    {
      "from": "TT22/Điều 2",
      "to": "TT41/Điều 8.2",
      "type": "SUPERSEDES",
      "note": "Bằng chứng B (thay thế một phần): chỉ bãi bỏ khoản 8.2; 8.1 vẫn còn hiệu lực."
    },
    {
      "from": "TT41/Điều 10",
      "to": "TT41/Điều 6.3",
      "type": "REFERENCES",
      "note": "Bằng chứng C (dẫn chiếu): Điều 10 trỏ tới Điều 6 — hệ thống tự kéo vào."
    }
  ]
}
